{
  "schema_version": 1,
  "atlas_id": "atlas-interoperability-lab",
  "core_commit": "072d7ca77981f51754e824d70c6d4ecd55ea67e5",
  "generated_at": "2026-08-30T20:37:49Z",
  "status": "current",
  "policy": {
    "transitive_staleness": true,
    "digest_only_closure_forbidden": true,
    "actual_rerun_required": true,
    "missing_rerun_targets_fail": true,
    "proof_structure_invariant": true,
    "closure_plan_structure_invariant": true
  },
  "inputs": [
    {
      "id": "repository-contract",
      "kind": "contract",
      "members": [
        "repo.yaml"
      ],
      "baseline_digest": "sha256:434b9851cca41f10bff2b7739f04704d299db4b725f826bd5e13f6d923165e70",
      "current_digest": "sha256:434b9851cca41f10bff2b7739f04704d299db4b725f826bd5e13f6d923165e70",
      "observed_at": "2026-08-30T20:36:51Z"
    },
    {
      "id": "composition-source",
      "kind": "source",
      "members": [
        "compatibility/evidence-dependency-core.lock.json",
        "compatibility/subject-binding-candidates.lock.json",
        "schemas/subject-binding-admission.schema.json",
        "compositions/fixture-stage2.json",
        "compositions/fixture-stage2-v2-definitive.preview.json",
        "migrations/runtime-binding-executable-attestation.json",
        "attestations/fe-upstream.local-report.json",
        "attestations/fe-upstream.attestation.json",
        "attestations/fe-upstream.attestation.json.sig",
        "attestations/fe-upstream.allowed-signers",
        "fixtures/subjects/fixture-http-source/release.json",
        "fixtures/subjects/fixture-http-source/completion-certificate.json",
        "fixtures/subjects/fixture-http-sink/release.json",
        "fixtures/subjects/fixture-http-sink/completion-certificate.json",
        "cmd/fixture-subject/main.go"
      ],
      "baseline_digest": "sha256:40691c06a5e9ddd061bffcaa2dc6ac11cc82374966d3c5cd2a3a91b4a73bf1f4",
      "current_digest": "sha256:40691c06a5e9ddd061bffcaa2dc6ac11cc82374966d3c5cd2a3a91b4a73bf1f4",
      "observed_at": "2026-08-30T20:36:51Z"
    },
    {
      "id": "interop-harness",
      "kind": "harness",
      "members": [
        "cmd/atlas-lab/main.go",
        "graphs/fixture-stage2.claim-evidence.json",
        "internal/lab/checkpoint_publication.go",
        "internal/lab/checkpoint_runtime.go",
        "internal/lab/composition_compatibility.go",
        "internal/lab/composition_evidence_audit.go",
        "internal/lab/composition_evidence_dependency.go",
        "internal/lab/composition_evidence_matrix.go",
        "internal/lab/definitive.go",
        "internal/lab/depth.go",
        "internal/lab/diagnose.go",
        "internal/lab/editorial.go",
        "internal/lab/engine.go",
        "internal/lab/evidence_dependency_matrix.go",
        "internal/lab/files.go",
        "internal/lab/gates.go",
        "internal/lab/graph.go",
        "internal/lab/nonregression.go",
        "internal/lab/nonregression_matrix.go",
        "internal/lab/pinned_core.go",
        "internal/lab/public_ci.go",
        "internal/lab/repository_contract.go",
        "internal/lab/runtime.go",
        "internal/lab/runtime_attested_run.go",
        "internal/lab/runtime_binding.go",
        "internal/lab/runtime_binding_migration.go",
        "internal/lab/scenario_contract.go",
        "internal/lab/selfaudit.go",
        "internal/lab/subject_binding_admission.go",
        "internal/lab/types.go",
        "internal/lab/validate.go",
        "oracles/failure-recovery-v1.json",
        "oracles/http-json-v1.json",
        "oracles/security-boundary-v1.json",
        "scenarios/compatibility.json",
        "scenarios/failure.json",
        "scenarios/normal.json",
        "scenarios/recovery.json",
        "scenarios/rejection.json",
        "tests/fixtures/composition-compatibility.matrix.json",
        "tests/fixtures/composition-evidence-dependency.matrix.json",
        "tests/fixtures/subject-binding-admission.matrix.json"
      ],
      "baseline_digest": "sha256:2e3b85b393777b4009f25b4a4f3f48c0b28e2ffab2a79cf383387f4e41204eda",
      "current_digest": "sha256:2e3b85b393777b4009f25b4a4f3f48c0b28e2ffab2a79cf383387f4e41204eda",
      "observed_at": "2026-08-30T20:36:51Z"
    },
    {
      "id": "go-runtime",
      "kind": "runtime",
      "members": [
        "go.mod"
      ],
      "baseline_digest": "sha256:3d7647ca4d4f397a9dbf167e30dacb28d1c90fbd907a3a36f1d2ce045f591aeb",
      "current_digest": "sha256:3d7647ca4d4f397a9dbf167e30dacb28d1c90fbd907a3a36f1d2ce045f591aeb",
      "observed_at": "2026-08-30T20:36:51Z"
    },
    {
      "id": "local-profile",
      "kind": "profile",
      "members": [
        "environments/local.json"
      ],
      "baseline_digest": "sha256:3781e09d4802de869b1f578ceb4bc82eba9a75342723954315644cdb95bcb6e6",
      "current_digest": "sha256:3781e09d4802de869b1f578ceb4bc82eba9a75342723954315644cdb95bcb6e6",
      "observed_at": "2026-08-30T20:36:51Z"
    },
    {
      "id": "container-profile",
      "kind": "profile",
      "members": [
        "environments/container.json",
        "environments/Dockerfile.fixture"
      ],
      "baseline_digest": "sha256:9d88fae91884a0afcd18a3ec27aa8ceaa071c4d4f173b2144ca29a35056010b2",
      "current_digest": "sha256:9d88fae91884a0afcd18a3ec27aa8ceaa071c4d4f173b2144ca29a35056010b2",
      "observed_at": "2026-08-30T20:36:51Z"
    }
  ],
  "outputs": [
    {
      "id": "local-binding",
      "kind": "runtime-evidence",
      "path": "evidence/preview/runtime-binding/local.binding.json",
      "digest": "sha256:909b8241a1670b032c92e3cd4e6db3dbd848ce68c51f18136a8c821f0383495c",
      "depends_on": [
        "repository-contract",
        "composition-source",
        "interop-harness",
        "go-runtime",
        "local-profile"
      ],
      "status": "current",
      "run_id": "run-local-runtime-binding"
    },
    {
      "id": "local-summary",
      "kind": "runtime-evidence",
      "path": "evidence/preview/runtime-binding/local/summary.json",
      "digest": "sha256:d5864c8b118165d65b5c734b83c433aec01171f09fd4656d6a465b11ab1e9f95",
      "depends_on": [
        "repository-contract",
        "composition-source",
        "interop-harness",
        "go-runtime",
        "local-profile"
      ],
      "status": "current",
      "run_id": "run-local-runtime-binding"
    },
    {
      "id": "local-normal",
      "kind": "runtime-evidence",
      "path": "evidence/preview/runtime-binding/local/normal.json",
      "digest": "sha256:85b6adfd9d756123a309ae789057e4344067c598bbe660468c9840d2ef0afead",
      "depends_on": [
        "repository-contract",
        "composition-source",
        "interop-harness",
        "go-runtime",
        "local-profile"
      ],
      "status": "current",
      "run_id": "run-local-runtime-binding"
    },
    {
      "id": "local-rejection",
      "kind": "runtime-evidence",
      "path": "evidence/preview/runtime-binding/local/rejection.json",
      "digest": "sha256:1759c0dd1184ac2925b63c192de5e5e4f78b21443e78ef2c333aa9f6177d4eb1",
      "depends_on": [
        "repository-contract",
        "composition-source",
        "interop-harness",
        "go-runtime",
        "local-profile"
      ],
      "status": "current",
      "run_id": "run-local-runtime-binding"
    },
    {
      "id": "local-failure",
      "kind": "runtime-evidence",
      "path": "evidence/preview/runtime-binding/local/failure.json",
      "digest": "sha256:b0e2d2390e084005332ea5b84bb31b80f132328677266bf68784609da3429488",
      "depends_on": [
        "repository-contract",
        "composition-source",
        "interop-harness",
        "go-runtime",
        "local-profile"
      ],
      "status": "current",
      "run_id": "run-local-runtime-binding"
    },
    {
      "id": "local-recovery",
      "kind": "runtime-evidence",
      "path": "evidence/preview/runtime-binding/local/recovery.json",
      "digest": "sha256:dc17a5ca1aa1a06c3dd49abcfd02c56c21be1a575e40785a13737d11b87f61e5",
      "depends_on": [
        "repository-contract",
        "composition-source",
        "interop-harness",
        "go-runtime",
        "local-profile"
      ],
      "status": "current",
      "run_id": "run-local-runtime-binding"
    },
    {
      "id": "local-compatibility",
      "kind": "runtime-evidence",
      "path": "evidence/preview/runtime-binding/local/compatibility.json",
      "digest": "sha256:059754e00bdf32405d1ba8ceaf25be0bd43634e9726a82ea853d7504263b6f4e",
      "depends_on": [
        "repository-contract",
        "composition-source",
        "interop-harness",
        "go-runtime",
        "local-profile"
      ],
      "status": "current",
      "run_id": "run-local-runtime-binding"
    },
    {
      "id": "local-cleanup-receipt",
      "kind": "runtime-evidence",
      "path": "evidence/preview/runtime-binding/local/cleanup.receipt.json",
      "digest": "sha256:316eff76611497dc1bcffdc95643c7315fe3945493b841fe23fa007f40a2e177",
      "depends_on": [
        "repository-contract",
        "composition-source",
        "interop-harness",
        "go-runtime",
        "local-profile"
      ],
      "status": "current",
      "run_id": "run-local-runtime-binding"
    },
    {
      "id": "container-binding",
      "kind": "runtime-evidence",
      "path": "evidence/preview/runtime-binding/container.binding.json",
      "digest": "sha256:e33537df9330e931014848c1f638668383744eeece983ffe4d996f45b1381a08",
      "depends_on": [
        "repository-contract",
        "composition-source",
        "interop-harness",
        "go-runtime",
        "container-profile"
      ],
      "status": "current",
      "run_id": "run-container-runtime-binding"
    },
    {
      "id": "container-summary",
      "kind": "runtime-evidence",
      "path": "evidence/preview/runtime-binding/container/summary.json",
      "digest": "sha256:9c01d74b27af576e5cceb64f4f967272820c9d6a67664da69978bdf4a95f1e25",
      "depends_on": [
        "repository-contract",